headline,label
सचिन तेंडुलकरने बाळासाहेबांच्या आठवणींना दिला उजाळा,state
"बहुजन वंचित आघाडीची पहिली यादी जाहीर, प्रकाश आंबेडकरांच्या मतदारसंघावरुन सस्पेंन्स कायम",state
"गृहमंत्रिपद हे पार्ट टाइम नाही, राजीनामा द्या, तृप्ती देसाईंची मुख्यमंत्र्यांवर टीका",state
पुण्यात आघाडीचा पोपट पुन्हा जिवंत !,state
शरद पवार यांनी मिलिंद नार्वेकर यांच्या कानात काय सांगितलं असेल?,state
ग्रेट भेटमध्ये अंजली भागवत - भाग 3,state
'तारक मेहता..'चा कलाकार विशाल ठक्कर 11 दिवसांपासून बेपत्ता,state
'दंगल'मुळे स्माॅल स्क्रीन थिएटर्सला फायदा,entertainment
चाहत्याने खांद्यावर हात ठेवताच सोनू निगमने केलं असं काही की सारेच झाले अवाक्!,entertainment
जळगावातल्या 'त्या' नरभक्षक बिबट्याने आतापर्यंत घेतलेत 6 बळी,state
मराठवाड्यात पावसाचं कमबॅक ; मुंबईसह राज्यातही संततधार,state
हृतिक करतोय बायोपिक 'सुपर 30',entertainment
महाराष्ट्राची सुवर्णकन्या तेजस्विनी सावंतचं पुणे विमानतळावर जोरदार स्वागत,sports
दुसऱ्याच आठवड्यात 'पद्मावत'चा '200 कोटीं'चा टप्पा पार,entertainment
नागराजच्या आयुष्याची गोष्ट 'नाळ'?,entertainment
'आपला मानूस'च्या हिंदी रिमेकमध्ये सोनाक्षी सिन्हा,entertainment
चंद्रकांत गुडेवार यांची अखेर बदली,state
"ढिंच्याक पूजाचा पाकिस्तानी चाहता, 'सेल्फी मैंने..'चं केलं रॅप साँग",entertainment
"राज्यात प्रचाराच्या तोफा थंडावल्या, 'गुरु'वारी अखेरची 'परीक्षा'",state
पुण्याचा कारभारी कोण ? दादा का भाऊ ?,state
जस्टिस लोया यांचा मृत्यू ह्रदयविकारानंच; नागपूर पोलिसांचं स्पष्टीकरण,state
मायकल शूमाकर कोमातून बाहेर,sports
उद्धव ठाकरेंच्या नाणारमधल्या  सभेवर प्रकल्पग्रस्तांचा बहिष्कार,state
सोलापुरात प्रेमी युगुलांना एबीव्हीपीच्या कार्यकर्त्यांची मारहाण,state
आयसीसीच्या कार्याध्यक्षपदी एन श्रीनिवासन,sports
"नागपूर की गुन्हेपूर ?, महिन्याभरात 3 सामूहिक बलात्काराच्या घटना",state
"'ऐ दिल है मुश्किल' VS 'शिवाय', बॉक्स ऑफिसवर आज चुरस",entertainment
"VIDEO : कोल्हापुरात राडा, पोलिसांनी केला शेतकऱ्यांवर लाठीमार",state
87वं अ.भा.साहित्य संमेलन 3 जानेवारीला,state
नागपुरात अपघातग्रस्तांना वाचवण्यासाठी शरद पवार स्वतः धावून गेले,state
"पुणे विकास आराखड्यावरुन रणकंदन, काँग्रेस-भाजपचा विरोध",state
औरंगाबादेत 108 रुग्णवाहिकेचे डॉक्टर आणि चालक संपावर,state
दारूच्या बाटल्यांमुळे विधान भवन परिसरात तुंबलं पाणी,state
"छगन भुजबळ ईडीच्या आॅफिसमध्ये पोहचले, चाैकशी सुरू",state
"PHOTOS 'हिच्या'पुढे धोनी, विराटचे रेकॉर्डही पडतील फिके; कोण आहे ही महिला खेळाडू?",sports
"मुख्यमंत्र्यांच्या नागपुरात चाललंय काय?, गुंडाने काढली प्रजासत्ताक दिनी रॅली",state
"न्यूज 18 लोकमतचा दणका, पाच तासात गोदावरीतले अवैध होर्डिंग हटवले",state
युती करा आणि अडीच अडीच वर्षे वाटून घ्या -मा.गो.वैद्य,state
सरकारचं नाक दाबलं तरच तोंड उघडतं; शेतकऱ्यांची दोन वर्षातील आंदोलनं,state
"युती तुटली तर पुन्हा निवडणुका, राष्ट्रवादीचा इशारा",state
"मेक्सिकोने ब्राझीलला रोखले, मॅच ड्रॉ !",sports
निवडणुकीत मालमत्तेची माहिती लपवल्याप्रकरणी आमदार  बच्चू कडूंवर गुन्हा दाखल,state
"रेशन दुकानदाराला काळाबाजारी पडली महागात, गावकर्‍यांनी काढली नग्न धिंड",state
"'डॅडी'मध्ये अर्जुन रामपाल डॅडी,फरहानची भूमिका नाही",entertainment
"VIDEO: राणेंची पक्षातून हकालपट्टी करा, कोकणातील भाजप नेत्याची मागणी",state
PHOTOS  टायगर श्रॉफशी झालेल्या ब्रेकअपनंतर दिशा कुठे होती गायब?,entertainment
पुण्यात मनसे नगरसेविका रुपाली पाटील यांच्यावर हाणामारीचा आरोप,state
'बावरा मन'चे सोनेरी क्षण,entertainment
मुंबई -पुणे एक्स्प्रेस वेवर दोन दिवस ब्लॉक,state
डॉ. मनमोहन सिंगांवरच्या सिनेमात सुझान बरनर्ट साकारणार सोनियांची भूमिका,entertainment
क्रिकेट जगतात नवा वाद : ऑस्ट्रेलियाचा खेळाडू मोईनला म्हणाला होता 'ओसामा'!,sports
अण्णांची प्रकृती खालावली,state
"मुंबईसह सांगली, सोलापूरकरांचं टोल नाय देणार !",state
पोलिसांना पाहुन पळाले अन् पितळ उघडे पडले !,state
"VIDEO पंकजा मुंडेंनी केलं शरद पवारांचं कौतुक, म्हणाल्या पवारसाहेब 'या' अभिनेत्यासारखे",state
पुणतांब्यात शेतकऱ्यांनी सरकारचं घातलं दहावं,state
"फडणवीस सरकारच्या या मंत्र्याचा बंगला बेकायदेशीर, काय आहे प्रकरण ?",state
"Mauni Amavasya 2019: या दिवशी ब्रह्मा, विष्णु आणि महेशही लावतात संगमात डुबकी, अमृत होतं पाणी",entertainment
धनगर आरक्षण समितीच्या कार्यकर्त्यांनी उपोषण सोडलं,state
मेरील स्ट्रीपला 20वं आॅस्कर नामांकन,entertainment
"बिग बाॅसचा राडा, सलमानच्या विरोधात पोलिसात तक्रार दाखल",entertainment
शनि चौथर्‍यावरील महिला प्रवेशाचा मार्ग अखेर मोकळा,state
बाहुबली-2 पाहिला नाही म्हणून कामावरून काढून टाकलं,entertainment
गडचिरोलीत माओवाद्यांच्या भूसुरुंग स्फोटात 12 जवान जखमी,state
लिफ्ट देऊन रिक्षाचालकानेच केला अल्पवयीन मुलीवर बलात्कार,state
मराठी बॉक्स क्रिकेट लीगच्या निमित्ताने,entertainment
नवाजुद्दीनवर त्याच्या पहिल्या गर्लफ्रेंडनं ठोकला 2 कोटींचा दावा,entertainment
"'3 इडियट्स'चे फुंसुक वांगडू केबीसीमध्ये, जिंकले 50 लाख",entertainment
"ना ऐश्वर्या,ना माधुरी, 'केबीसी 9'चं सूत्रसंचालन करणार अमिताभ बच्चनच !",entertainment
"एकाच साच्यातून चार रिव्हॉल्वर ?, चार जणांचा खून",state
"3 चेहरेमध्ये प्राजक्ता माळी, मिलिंद जोशी आणि आतिषा नाईक",entertainment
ऊस दर आंदोलन:मुख्यमंत्री घेणार राजू शेट्टींची भेट,state
"कोलकाता 'जितबो रे', दिल्लीवर शानदार विजय",sports
साहित्य संमेलनाची ग्रंथदिंडी,state
वीरपत्नी स्वाती महाडिक लेफ्टनंटपदी रुजू,state
"'धोनी ब्रिगेड' 'विराट सेने'वर भारी, चेन्नई पहिल्या स्थानावर !",sports
"पोटच्या मुलीशी अनैतिक संबंध असल्याच्या संशय, जातपंचायतीची आमानुष शिक्षा",state
ठाण्याच्या महापौरपदी शिवसेनेच्या संजय मोरेंची निवड,state
कर्जाला कंटाळून शेतकरी भावांची आत्महत्या,state
गायक अभिजीतची ट्विटरनं केली बोलती बंद,entertainment
Election 2019 : शरद पवारांनी माढ्यातून माघार घेण्याची ही आहेत 5 कारणं,state
कोण होणार कोल्हापूरचा 'सुभेदार' ?,state
'बाहुबली'च्या कुंकवाची चित्तरकथा,entertainment
युवकांसाठी फडणवीस सरकारचं भन्नाट दिवाळी गिफ्ट; 4738 पदांवर होणार भरती!,state
महाराष्ट्राचं मिनी काश्मीर गारठलं; पारा 9 अंशाखाली!,state
'50 लाख लोकसंख्येचा देश वर्ल्ड कप खेळतो आणि आपण हिंदू- मुस्लिम खेळतोय' - हरभजन सिंग,sports
यात्रेकरूंच्या नातेवाईकांना अजितदादांनी ठेवलं ताटकळत,state
"गॅस सिलेंडरचा स्फोट, कुटुंबातील चौघांचा होरपळून मृत्यू",state
"'युती' झाली नाही तर फटका बसणार, भाजपच्या बैठकीत खासदारांची चिंता!",state
महाआघाडीला 'इंजिन' जोडण्यासाठी 'घड्याळ' उत्सुक; नांदगावकरांनी केलं 'हे' सूचक वक्तव्य,state
"कोपर्डी बलात्कार आणि खून खटल्यात तिन्ही आरोपी दोषी सिद्ध, 21 नोव्हेंबरला सुनावणार शिक्षा",state
न्यूज18लोकमत इम्पॅक्ट : लाखो वारकऱ्यांसाठी चंद्रभागेत उजनी धरणातून सोडलं पाणी,state
"सांगलीकर स्मृतीकडे टीम इंडियाची कमान, विश्वचषकाबद्दल म्हणते...",sports
संभाजी ब्रिगेडमध्ये फूट;प्रवीण गायकवाड नव्या ब्रिगेडचे अध्यक्ष,state
आझादसाठी आमिर खान बनला सांता !,entertainment
'बिनकामाचे संवाद'च्या निमित्तानं,entertainment
विराट नंबर  1,sports
VIDEO : शेतकरी प्रश्नावरून राजू शेट्टींचा मुख्यमंत्री फडणवीसांवर गंभीर आरोप,state
"दाक्षिणात्य सुपरस्टार महेश बाबूने रचला इतिहास, कोणताच बॉलिवूड कलाकार हे करू शकत नाही",entertainment
९७वं नाट्य संमेलन उस्मानाबादला होणार,entertainment
ठाण्यात महिला पोलीस कॉन्स्टेबलची गळफास लावून आत्महत्या,state
बंजारा समाजाचा होळीचा जलसा,state
'गौरी आल्या घरा'मध्ये इशा केसकर,entertainment
पारोळामध्ये छत कोसळून चौघांचा मृत्यू,state
महाराष्ट्राच्या राज्यपालांचा राजीनामा देण्यास नकार,state
आकाश अंबानीच्या मेहेंदी कार्यक्रमात प्रियंका चोप्रा!,entertainment
PHOTOS : आलिया पुन्हा एकदा होतेय ट्रोल; कारण आहे या 'नाईट ड्रेस'ची किंमत,entertainment
'मराठा क्रांती मोर्चाचे कुठलेही समन्वयक मुख्यमंत्र्यांच्या भेटीला जाणार नाहीत',state
"नांदेड-मनमाड पॅसेंजरला आग, प्रवाशांची सुरक्षा ऐरणीवर",state
बाॅलिवूडचा गाॅडफादर सलमाननं शाहरुखलाही केलं होतं लाँच,entertainment
...छगन भुजबळ बेपत्ता !,state
देवेंद्र फडणवीस लवकरच माजी मुख्यमंत्री होतील - संजय राऊत,state
सेनेचे खा. वाकचौरे करणार काँग्रेसमध्ये प्रवेश,state
एकटा विराट 730 दिवसांपासून पडतोय पाकिस्तानवर भारी,sports
दाभोलकर आणि पानसरेंवर हल्ल्यामागे सूत्रधार एकच -एन.डी.पाटील,state
मी 'या' अटीवरच लग्न करेन - मुक्ता बर्वे,entertainment
कराडमध्ये भाजप नेत्याची महिला पोलिसाला दमबाजी,state
"नगरपरिषदेच्या दुसऱ्या टप्प्यात सरासरी 72 टक्के मतदान, दिग्गजांचा भवितव्य मतपेटीत बंद",state
"कोल्हापुरात टोलविरोधात एल्गार, टोलवसुलीचा प्रयत्न हाणून पाडला",state
"'काॅफी विथ करण' होतोय सुरू, 'या' कलाकारांची असेल उपस्थिती",entertainment
एका पर्वाचा अस्त,sports
दक्षिण आफ्रिकेतून अचानक अनुष्का का परतली?,entertainment
"कोर्टाच्या आदेशानंतर एसटीचा संप अखेर मागे, प्रवाशांना भाऊबिजेला दिलासा",state
"रावते तुमचा कर्मचाऱ्यांवर भरोसा नाय का?,संतप्त कर्मचाऱ्यांचा सवाल",state
फिल्म रिव्ह्यु :'2 स्टेट्स' !,entertainment
बॉलिवूडचा भाईजान !,entertainment
जायकवाडीचं पाणी अडवण्यासाठी नेतेही रस्त्यावर उतरले,state
"पुण्यातील RTI कार्यकर्त्याचा मृतदेह ताम्हिणी घाटात, कुटुंबाकडून हत्येचा संशय",state
भोसरी एमआयडीसी प्रकरणात एकनाथ खडसेंना एसीबीची क्लीन चिट,state
'हाच माझा मार्ग',entertainment
फराह खान करणार मिस वर्ल्ड मानुषी छिल्लरला बॉलिवूडमध्ये लाँच?,entertainment
शेतकऱ्यांच्या लेकींचे अन्नत्याग...ते आजच्या 5 महत्त्वाच्या बातम्या,state
"रेकाॅर्डब्रेक कामगिरी, लातूरसाठी आता 25 लाख लीटर पाणी घेऊन 'वॉटर एक्स्प्रेस' निघणार !",state
"पीएचडीचा काळाबाजार करणारी गीता पाटील मोकाट, विद्यार्थ्यांचीच मुस्कटदाबी",state
'शिवाजी अंडरग्राउंड इन..' @200,entertainment
कॉ. पानसरे यांच्यावर 2 बंदुकीतून 5 गोळ्या झाडल्या!,state
VIDEO : बिग बींनी लगावला भाजपच्या मंत्र्याला टोला,entertainment
कोकण रेल्वेची वाहतूक पुढचे 14 तास ठप्प,state
"महाराष्ट्राच्या राजकारणात आणखी एका पक्षाची एंट्री, लोकसभेसाठी 14 उमेदवारांचीही घोषणा",state
PHOTOS ३ सामन्यांत ३ नवे गडी : भारतीय क्रिकेटपटूंनी तिसऱ्यांदा रचलाय हा इतिहास,sports
"मुख्यमंत्र्यांच्या हेलिकॉप्टर अपघाताला 1 वर्ष पूर्ण, पण कांबळे कुटुंबाला नुकसान भरपाई नाहीच",state
"राणेंना चपराक, 'अक्षता'चा भूखंड बेकायदेशीर",state
देवदूत मच्छीमाराने वाचले 'त्या' तिघांचे प्राण,state
प्रख्यात गायक मुकुल शिवपुत्र यांच्याकडून चोरट्याने 75 हजार लांबवले,state
मराठा आरक्षणाविरोधातील याचिका MIM आमदार इम्तियाज जलील यांनी घेतली मागे,state
पाथर्डीत अडीच लाखांची लाच घेताना पोलीस निरीक्षकाला अटक,state
"शेतकऱ्यांची क्रूर थट्टा, पीक विम्याचा मिळाला फक्त एक रूपया",state
PHOTOS : सनी लिओनने केरळसाठी खरंच 5 कोटींची मदत केली का ?,entertainment
राज्यातल्या काही साखर कारखान्यांनी थकवले शेतकर्‍यांचे 1800 कोटी रुपये,state
विराट कोहलीचा डुप्लिकेट तुम्ही पाहिलात का?,state
'इंदू सरकार'च्या विरोधात नागपुरात काँग्रेस कार्यकर्त्यांची निदर्शनं,entertainment
"लष्कराची स्पेशल ट्रेन रूळावरून घसरली, डब्यात शस्त्रसाठा?",state
आमिरशी टक्कर घ्यायला फैझल खान तयार,entertainment
"नागपुरात रिकाम्या फ्लॅटमध्ये सापडली 1 कोटी 87 लाखांची रोकड, 4 जणांना अटक",state
"'सुपर 30'चं फर्स्ट लूक रिलीज, हृतिक रोशनचा वेगळा अवतार",entertainment
"ईराणी चषक : मुंबईकर फ्लॉप, हनुमा विहारीच्या शतकाने शेष भारताला सावरले",sports
"इतकी टीका होतेय तर स्वत:हून राजीनामा द्यावा, नानांचा चौहानांना सल्ला",state
"उगम 'गिरणगाव महोत्सवा'चा - दत्ता इस्वलकर, अनिता पाटील",state
लालन सारंग यांची रंगमंचावर रिएंट्री,entertainment
'अनब्रेकेबल' मेरी कॉम,sports
राम कदम यांचं नाव 'रावण' कदम ठेवा - अजित पवार,state
"अणेंना उपरती, महाराष्ट्राचा केक कापल्याबद्दल मागितली माफी",state
"रणवीर-दीपिका जून-जुलैमध्ये लग्नबंधनात, करणार डेस्टिनेशन वेडिंग!",entertainment
"सचिन तेंडुलकर होऊन तुम्हीही खेळून शकतात, 'सचिन सागा..' गेम लाँच",sports
"ऑस्ट्रेलियाचा विजयी 'चौकार', भारताचा पुन्हा लाजिरवाणा पराभव",sports
"जेव्हा पंकजा मुंडे आणि पूनम महाजन म्हणतात, कुछ कुछ होता है!",entertainment
"पावसासाठी पर्जन्ययज्ञ करायला हवा, शंकराचार्यांचा सल्ला",state
गडकरींच्या 'राज'नितीमुळे शिवसेना नाराज,state
