headline,label
सवर्ण आरक्षणावर कोर्टात सुनावणी...आजच्या 5 महत्त्वाच्या बातम्या,state
योगेश्वर दत्त आणि बबिता कुमारीने पटकावले सुवर्णपदक,sports
रॉजर फेडरर इतिहास घडवणार?,sports
CWG 2018 : बॅडमिंटन पुरुष एकेरीत के श्रीकांतला रौप्य पदक,sports
इम्फाचा सफरनामा,entertainment
"पुण्यात निर्वस्त्र नायजेरियन तरुणाचा उच्छाद, पुणेकरांनी दिला चोप",state
सुप्रसिद्ध गायक सुरेश वाडकर आणि पद्मा वाडकरांसोबत सुरेल गप्पा,entertainment
"नागपूरमध्ये अल्पवयीन मुलीवर सामूहिक बलात्कार, तीनही नराधम अटकेत",state
"अब जाकर मेरे चेहरे पर मुस्कान आई है, बाॅलिवूडकरांनी केलं अभिनंदनचं स्वागत",entertainment
बबनराव पाचपुते अपक्ष म्हणून रिंगणात,state
पंकजा मुंडेंनी घेतलं शनैश्वराचं दर्शन,state
नाशिकमध्ये रस्त्यासाठी 3 हजार झाडांची होणार कत्तल,state
शो टाईम - कानमध्ये ऐश्वर्याची नजाकत,entertainment
"दुष्काळाचं संकट दूर होवो, मुख्यमंत्र्यांचं विठुरायाला साकडं",state
गारपीटग्रस्ताच्या पाहणीऐवजी महसूलमंत्री चित्रपट पाहण्यात दंग,state
पुणे जिल्हाधिकारी कार्यालयाबाहेर एकाचा जाळून घेण्याचा प्रयत्न,state
"आईच्या चितेशेजारीच मुलाची आत्महत्या, स्कॉर्पिओ गाडीसह घेतलं पेटवून!",state
शेतजमीन बळकावण्यासाठी आदिवासी कुटुंबाला मारहाण,state
"'सेनेचा दबाव भाजपनं झुगारला, विश्वासदर्शक ठरावानंतरच मंत्रिमंडळाचा विस्तार'",state
डीएसकेंचा मुलगा शिरीष कुलकर्णी कोर्टासमोर शरण,state
दीपिका-रणवीरच्या लग्नाचा नवा Photo झाला व्हायरल,entertainment
लातूर-नांदेड महामार्गावर भीषण अपघातात 7 जण जागीच ठार,state
"'विदर्भ इन्फोटेक' वादाच्या भोवऱ्यात,धनंजय मुंडेंची चौकशीची मागणी",state
शेतकर्‍यांना पूर्ण कर्जमाफी मिळणार का?,state
"ऐश्वर्याचं कमबॅक, 'जज्बा'चा कडक ट्रेलर रिलीज",entertainment
Lok Sabha Elections 2019 : उस्मानाबाद मतदारसंघामध्ये कधी होणार मतदान?,state
सांगलीत नरबळी ?,state
शिवसेनेच्या पराभूत उमेदवार भाग्यश्री रंधवे 6 दिवसांपासून बेपत्ता,state
सिद्धार्थ चांदेकरनं साजरा केला मितालीसोबत व्हॅलेंटाइन्स डे!,entertainment
घरगुतीसह सर्वच वीजदरात 20 टक्के कपात,state
'डाळी दर नियंत्रण' विधेयकातल्या तरतुदींवर केंद्राचा आक्षेप,state
मला गडकरींची काळजी वाटते - शरद पवार,state
राज्यभरात पावसाचे धुमशान,state
नाशिक मनसेतला वाद चिघळण्याची शक्यता,state
तिसरा प्रयत्न अन् वाघोबा शिडीच्या मदतीने बाहेर निघाले,state
माध्यमिक शाळांना आठवीचा वर्ग जोडू नका !,state
दलित वस्तीचा पाणीपुरवठा बंद करणार्‍या उपसरपंचाला अखेर अटक,state
"PHOTOS : उद्या सुट्टी, काॅलेज जाण्याचा आजचा दिवस अखेरचा ठरला !",state
अर्जुन आणि आलियाचा '2 स्टेटस्',entertainment
#FitnessFunda : आदिनाथ कोठारेला आहे व्यायामाचं व्यसन,entertainment
VIDEO : 'रणजी'तील विजयावर फैज फाजल म्हणतो...,sports
'उद्धवना बाळासाहेबांचं स्मारक सुद्धा बांधता आलं नाही',state
'बालचित्रवाणी' मोजतेय अखेरीच घटका !,state
"'बिग बाॅस'ची लढाई ; कोणं जिंकलं, कोण हरलं ?",state
भारताच्या या कामगिरीवर विराटची रिअॅक्शन; चाहत्यांनी केले ट्रोल!,sports
रेश्मा भोसलेंच्या पतीने थकबाकी लपण्यास मदत केली -मोरे,state
लता दीदी@90 : ...आणि लता दीदींनी रफी साहेबांसोबत गायला दिला नकार,entertainment
गोविंद पानसरे हत्येप्रकरणी आणखी एका तपास अधिकार्‍याची बदली,state
Kader Khan- लाचार आयुष्याची यशस्वी कहाणी,entertainment
#FitnessFunda : फिट राहण्यासाठी 'फुलराणी' करते हे घरगुती उपाय,entertainment
'वेलकम बॅक गांधी'मध्ये अनुपम खेर राजकीय तज्ज्ञाच्या भूमिकेत,entertainment
"'लेक लाडकी' फक्त बोलण्यापुरतं, मुलींच्या जन्मदरात घट",state
भाजपकडून पूनम महाजन यांना तिकीट,state
VIDEO: कांद्यानेच मंत्र्यांना शुद्धीवर आणा आणि परत कांदा फेकून मारा - राज ठाकरे,state
"पालघरमध्ये फेरमतदानाची शिवसेनेची मागणी, निवडणूक आयोगाला दिलं पत्र",state
शिक्षक निघाले पुन्हा सुट्टीवर !,state
राष्ट्रपतीपदाच्या निवडणुकीच्या मतदानाला तरी जाऊ द्या-छगन भुजबळ,state
अजित पवारांच्या सभेत वीजचोरी,state
'फुंतरू'ची पहिली झलक,entertainment
"Asian Games-2018 : बोल बजरंग..,पूनियाने पटकावले सुवर्णपदक",sports
आशिया कपला आजपासून सुरुवात; बुधवारी रंगणार भारताचा पहिला सामना,sports
'मुंबईतील शाळांमध्ये अॅडमिशन म्हणजे पालकांसाठी अग्निदिव्य'-हायकोर्ट,state
बीसीसीआयचे अध्यक्ष जगमोहन दालमिया यांचं निधन,sports
"'ते' दोघे कोण , पुणे स्फोटाचं सीसीटीव्ही फुटेज ?",state
VIDEO : अति विषारी घोणसच्या 38 पिल्लांचा जन्मसोहळा !,state
"समीर निर्दोषच, 'सनातन'ची आदळआपट !",state
प्रकाश आंबेडकरांमुळेच महाराष्ट्र पेटला- संभाजी भिडे यांचा पलटवार,state
सई ताम्हणकर-शरद केळकर 'राक्षस'मध्ये एकत्र,entertainment
हिट अँड रन प्रकरणी सलमानवर आरोप निश्चित,entertainment
"जिल्हा परिषदेत भाजपच नंबर वन,राष्ट्रवादी दुसऱ्या क्रमांकावर",state
सावकारीविरोधी कायद्याला केंद्राची मंजुरी,state
पिसाळलेल्या कुत्र्याचा धुमाकूळ; 35 जणांचे तोडले लचके,state
"नक्षलग्रस्त भागात नवी पहाट, 412 तरूणांना नोकर्‍या !",state
VIDEO : सलमानसमोर कतरिनाला कोणी केलं प्रपोज?,entertainment
"श्वास रोखून धरा,'बाहुबली 3' ही येणार !",entertainment
ठाणे नगर पोलीस स्टेशनात इक्बालसोबत दाऊद इब्राहिमवरही गुन्हा दाखल,state
नववर्षाच्या स्वागताला मलायकाचा अनोखा फंडा,entertainment
"'बाबा' 'सुखरुप' परतले, कामाला लागले !",state
#MeToo विंता नंदा प्रकरणात आरोपी आलोक नाथ यांना अग्रिम जामीन,entertainment
"सचिन, सौरव आणि लक्ष्मण BCCIच्या क्रिकेट सल्लागार समितीत !",sports
अंध व्यक्ती कशा ओळखणार नव्या नोटा ?,state
"अहमदनगरलाही अवकाळी पावसाचा तडाखा, पिकं पाण्यात !",state
राज ठाकरे आजपासून महाराष्ट्र दौऱ्यावर;वसईत होणार पहिलं भाषण,state
"या सगळ्या कलाकारांचा आहे साईड बिझनेस, कमवतात बक्कळ पैसा",entertainment
रोंजन सोढीला यंदाचा राजीव गांधी खेलरत्न पुरस्कार,sports
"पुण्यात सरोगसी रॅकेटचा पर्दाफाश,3 महिलांना अटक",state
विक्रांतच्या आयुष्यात ईशा कसलं वादळ घेऊन येणार?,entertainment
लोकांचं माझ्यावर प्रेम; मीच जिंकून येणार - उदयनराजेंची गर्जना,state
"म्हणे,अनेक संतांना मीच पृथ्वीवर पाठवलं ; सिगारेटवाले बाबा पोलिसांच्या जाळ्यात",state
MCAची निवडणूक लढवणार -मुंडे,sports
'डोण्ट वरी बी हॅपी' म्हणतेय स्वानंदी टिकेकर!,entertainment
भय्यूजी महाराज यांच्या संपत्तीचे अधिकार 'या' सेवेदाराला ! सुसाईड नोटचा दुसरा भाग नेटवर्क18 च्या हाती,state
शिर्डी : कचर्‍याच्या गाडीतून नेलेल्या वृद्धाचा मृत्यू,state
मराठवाड्यात राज घेणार उमेदवारांच्या मुलाखती,state
VIDEO : हातात हात घालून पहिल्यांदा केला कतरिना-सलमाननं  रॅम्पवाॅक,entertainment
नागपूर : वकिलावर प्राणघातक हल्ला प्रकरणाला नवं वळण,state
"शाहरूखच्या नव्या टीव्ही शोचा ट्रेलर झाला व्हायरल, किंग खानची टीव्ही वापसी",entertainment
145 पैकी फक्त 75 गारपीटग्रस्त सरकारच्या मदतीस पात्र,state
"जाने कहाँ गये वो दिन, आता उरल्या फक्त आठवणी",entertainment
"VIDEO : ठाण्यात फिरतोय विचित्र 'पिनमॅन', मुलांना का टोचतोय टाचण्या?",state
"विराटच्या 'ट्रम्प कार्ड'ची कमाल, दूर केली रोहितची मोठी अडचण",sports
दिल्ली कोण गाठणार ? पाहा राज्यातील बिग फाईट्स,state
महाराष्ट्राच्या या उपमुख्यमंत्र्यांवरही झाले होते लैंगिक गैरवर्तनाचे आरोप,state
"राज्यात थंडीची लाट, परभणीमध्ये 3.6 अंश सेल्सियस तापमानाची नोंद",state
खळखळून हसवणारे 'डॉ. हंसराज हाथी' यांचं आकस्मित निधन,entertainment
नर्सरीत प्रवेश आता तीन वर्ष पूर्ण केल्यानंतरच !,state
PHOTOS : लग्नानंतर 'छप्पाक' सिनेमासाठी दीपिका पदुकोणची तयारी सुरू,entertainment
VIDEO मोदी-शहांवर असे फुटले राज ठाकरेंच्या व्यंगचित्राचे फटाके!,state
मुळा धरणाचं पाणी जायकवाडी धरणात पोहचलं,state
जागावाटपाचं चित्र येत्या 8 दिवसांत होणार स्पष्ट :शरद पवार,state
"तूर, मूग आणि उडदाच्या डाळीवरची निर्यातबंदी केंद्र सरकारने उठवली",state
सातार्‍यात राष्ट्रवादीचा तवा रिकामाच !,state
"'बाजीराव-मस्तानी'च्या अडचणीत वाढ, भंसाळींच्या विरोधात अब्रु नुकसानीचा दावा",entertainment
"माता न तू वैरणी, दीड वर्षांच्या चिमुरडीची विष पाजून हत्या",state
"युती नक्की होणार, शिवसेना खासदार अनिल देसाईंनी केलं स्पष्ट",state
'प्रेमासाठी कमिंग सून'च्या टीमशी गप्पा,entertainment
"बल्ले बल्ले, 88 वं साहित्य संमेलन पंजाबमध्ये",state
शेतकर्‍यांच्या कर्जमाफीसाठी राष्ट्रवादी काँग्रेस आक्रमक,state
"पारनेरमध्ये दोन गटात तुंबळ हाणामारी,सुरेश पठारेंवर गुन्हा दाखल",state
"दानवेंसाठी मुख्यमंत्री मैदानात, जालन्यात खोतकरांची बंडखोरी टाळण्यासाठी प्रयत्न",state
नरेंद्र की राह पर देवेंद्र...!!! मुख्यमंत्र्यांचं 'मोदी स्टाईल' राजकारण,state
अभिनेत्री उषा नाईक येतायत फुटबाॅल खेळायला!,entertainment
काश्मीरमध्ये दहशतवाद्यांविरोधात लढताना साताऱ्याचे जवान रवींद्र धनावडेंना वीरमरण,state
फवाद खाननंतर उरी हल्ल्यासंदर्भात माहीरानेही सोडले मौन,entertainment
"लोक काय म्हणतील याचा विचार करु नका, अमिताभ बच्चन यांचं नातींना पत्रं",entertainment
"मुनगंटीवार साहेब, जरा इकडे बघा; झाडांची कत्तल करून केला जातोय कोळसा !",state
"'आता शिट्टी वाजली की फौज तयार राहील', दिवाकर रावतेंची संघावर टीका",state
"पिंपरी चिंचवडमध्ये रिक्षावाले बनले महापौर, राहुल जाधव 80 मतांनी विजयी",state
ज्येष्ठ अभिनेते फारुख शेख कालवश,entertainment
राष्ट्रवादीच्या तालुकाध्यक्षाने बँकेवर दरोडा टाकल्याचं उघड,state
बोनी कपूर बनवतोय श्रीदेवीवर फिल्म,entertainment
"...तर तुमच्या पैशातून निवडणुका घ्या,खडसेंचा पक्षाला घरचा आहेर",state
"""भिडेंचं नाव तोंडी काढू नकोस, नाहीतर दाभोलकर करू"", भुजबळांनी जीवे मारण्याची धमकी",state
पेट्रोलपंप दर रविवारी सुट्टीवर जाणार !,state
"..अजूनही 'या' गावात शाळा नाही, मुलं शिकतात समाज मंदिरात !",state
'हॅम्लेट'मधल्या सुमित राघवनचा लूक पाहिलात का?,entertainment
संतोष मानेची फाशीची शिक्षा कायम,state
"VIDEO : एक्स्प्रेस वेवर कारचा विचित्र अपघात,सुरक्षा पट्टी कारच्या आरपार",state
EXCLUSIVE : आदित्य ठाकरे लोकसभा निवडणूक लढवणार? 'मातोश्री'वरून पहिली प्रतिक्रिया,state
"IND vs WI : वेस्ट इंडिजच्या दुसऱ्या डावात 127 धावा, भारतासमोर 72 धावांचं लक्ष्य",sports
परभणीत सेलू तहसील कार्यालयासमोरच अंत्यसंस्कार,state
मधुरा आणि सुबोध घेणार 'एक निर्णय',entertainment
गडचिरोलीसह 5 राज्यांमध्ये उद्या माओवाद्यांचा बंद,state
"माओवाद्यांच्या रणनीतीचा पर्दाफाश, सुरक्षादलांवर हल्ल्याचा व्हिडिओ न्यूज 18 लोकमतकडे",state
"सांगलीत कोपर्डीची पुनरावृत्ती, अल्पवयीन मुलीवर सामूहिक बलात्कार करून हत्या",state
"श्रीदेवीची आठवण करून देतात, जान्हवी कपूरचे 'हे' फोटो",entertainment
"इफ्फीमध्ये अक्षयमुळे बिग बी झाले ओशाळवाणे, म्हणाले, अक्षय हे ठीक नाही!",entertainment
"महिलांसोबत आता पुरुषांनाही शनी चौथर्‍यावर बंदी, ग्रामस्थांनी मांडला ठराव",state
वर्ल्डकप जिंकल्यास टीम इंडियावर बक्षिसांचा वर्षाव - बीसीसीआय,sports
ह्युजेसला निरोप,sports
एका वर्षात सत्तेला लाथ मारून सेना पुन्हा सत्तेत येणार -आदित्य ठाकरे,state
श्रीमंत व्हायचं असेल तर कांदा खाऊ नका - पणन मंत्री सुभाष देशमुखांचा अजब सल्ला!,state
Asia Cup 2018 : जेव्हा चक्क मैदानातच भांडले भारत-पाकिस्तानचे ‘हे’ खेळाडू,sports
"मुख्यमंत्री खोटारडे, राजीनामा द्या-नारायण राणे",state
अकोले दरोडा-सामूहिक बलात्कार प्रकरणी 6 आरोपी निर्दोष सुटले,state
माधुरीचा जलवा,entertainment
चिंचवडमध्ये दोन मांडूळ तस्करांना अटक,state
फिटनेस फंडा 23 जाने.,sports
अखेर बिबट्या जेरबंद,state
मृण्मयी देशपांडेची भाऊबीज,entertainment
"नाशिकमध्ये काँग्रेसच्या मदतीने सेनेचा भगवा फडकला, भाजप- राष्ट्रवादीची हातमिळवणी वाया",state
सुजय विखे मातोश्रीवर जाऊन घेणार उद्धव ठाकरेंची भेट,state
...जेव्हा सचिनने गोलंदाजीत कमाल केली,sports
मतदार प्रादेशिक पक्षांनाच पसंती देतात - उद्धव ठाकरे,state
सोनम कपूरनं सांगितला स्टाईल मंत्र!,entertainment
'डी डे' सिनेमाची झलक,entertainment
'हॅपी भाग जाएगी'च्या टीमशी गप्पा,entertainment
"'रखडलेला महाराष्ट्र'ची बजेटमध्ये दखल, नव्या एसटी आणि हॉस्पिटलसाठी भरीव तरतूद",state
आमच्या पोरांची वाट का लावली- राज ठाकरेंचा गिरीश बापटांना सवाल,state
आपलं साहित्य संमेलन - संभाजी भगत यांचे पोवाडे,entertainment
"Video : लग्नानंतरही आशियात सर्वात ‘सेक्सी’ दीपिकाच, प्रियांका चोप्राला टाकलं मागे",entertainment
"नागपूर जेलमध्ये कैद्याची हिरोगिरी, जेलमध्येच केलं फोटोसेशन !",state
पराभवाचा वचपा काढत भारताने मालिका जिंकली,sports
ताडोबा जंगलात शिकारीवरून दोन वाघांच्या झुंजीत एकाचा मृत्यू ?,state
"दुष्काळीभागात बांधकामांसाठी पाणी देऊ नका, कोर्टाचे आदेश",state
