headline,label
"VIDEO: अंबरनाथच्या डोंगराला भीषण आग, हजारो झाडं भक्षस्थानी",state
"'तेव्हा' विराटला स्टंपने मारावं वाटलं,आॅस्ट्रेलियाच्या क्रिकेटरचा धक्कादायक खुलासा",sports
'क्वांटिको'मध्ये प्रियांकाचा लूक,entertainment
वरूणराजा धाव रे; मराठवाड्यात 4 शेतकर्‍यांच्या आत्महत्या,state
क्रिकेटच्या 200 वर्षाच्या इतिहासात फक्त दुसऱ्यांदा 'असा' विक्रम!,sports
"कोल्हा'पूर'मय,एनडीआरएफच्या टीम दाखल",state
'कोसला'कार भालचंद्र नेमाडेंना 'ज्ञानपीठ' जाहीर,state
पिंपरी चिंचवडमधील अनधिकृत बांधकामांना मुख्यमंत्र्यांचा दिलासा,state
संघाच्या कार्यक्रमात उद्या मुखर्जींचं भाषण,state
अभिनेत्री श्रीदेवी यांचं हृदयविकाराच्या धक्क्याने निधन,entertainment
कोकण रेल्वेची वाहतूक अजूनही विस्कळीत,state
भारतीय महिला क्रिकेट संघ 12 वर्षांनंतर वर्ल्डकपच्या फायनलमध्ये,sports
"बोल बजरंग बली की जय, संगमनेरमध्ये महिलाच ओढता हनुमान रथ !",state
धक्कादायक! फेसबुकवरून झालेल्या प्रेमासाठी पत्नीने पतीचा काढला काटा,state
"बेळगाव पालिकेवर मराठी झेंडा, महापौरपदी किरण सायनाक",state
"थर्टीफस्टचा फिव्हर,चोरी केली 1 लाखांची 'बिअर' !",state
पुणे पोलीस आयुक्त पोळ यांच्या अटकेचे आदेश,state
मुंबईत गुरूद्वारावर भिंद्रनवालेचं पोस्टर !,state
"वाळू माफियांचा उच्छाद, तहसीलदारावर रोखलं पिस्तुल",state
तुटपुंज्या पगारावर 'धावणाऱ्या' एसटी कर्मचाऱ्यांचा संपाचा आजपर्यंतचा प्रवास,state
आता पाकिस्तानी कलाकारांना चित्रपटात घेणार नाही -करण जोहर,entertainment
औरंगाबादच्या महापौरपदी शिवसेनेचे त्र्यंबक तुपे,state
नाशिक : चारशे वर्ष जुन्या कालिका माता मंदिरातला नवरात्रोत्सव VIDEO,state
MCCचा उर्वरित विश्व संघावर 7 विकेट राखून विजय,sports
"रोमन रेन्सचा WWE ला अलविदा, 'या' आजाराशी देतोय झुंज",sports
नागपूरात सिमेंटच्या रस्त्यांची 50 वर्षांची गॅरंटी खोटी; उद्घाटनाआधीच रस्त्यांवर भेगा!,state
अमेरिकेतल्या वर्षा कलवारनं दिलं आश्रमशाळेतल्या विद्यार्थ्यांना लॅपटॉपचं प्रशिक्षण,state
सचिनची उद्या अखेरची कसोटी,sports
...आणि अस्वलानं रस्ता पार केला,state
गोकुळ दुधावरून तापलं कोल्हापुरातलं राजकारण!,state
घड्याळाचं बटन दाबाल तरच तुमच्याकडे लक्ष देऊ- अजित पवार,state
मुंबई-नागपूर सहापदरी महामार्ग बांधणार - मुख्यमंत्री,state
VIDEO : 'विराट मैदानात चुकीच्या मानसिकतेने उतरला',sports
"'द कपिल शर्मा शो' परत येतोय, कोण-कोण असणार सस्पेन्स कायम",entertainment
"दिवस पालटले, काँग्रेसचे दिग्गज नेते 'रस्त्यावर' !",state
'मी जगातल्या सगळ्या छोट्यांची जबाबदारी घेतली नाही' - सैफ अली खान,entertainment
अमरावीत नववीत शिकणाऱ्या विद्यार्थिनीवर अॅसिड हल्ला,state
..तर 6 महिन्यांत मला अटक करा- राहुल गांधी,state
शीळफाट्यात MIDC ची पाईपलाईन फुटली,state
"IPL 2018 : केकेआरला मोठा धक्का, आॅस्ट्रेलियाचा सार्क आयपीएलमधून बाहेर",sports
50 वाघांची शिकार करणारा तस्कर पोलिसांच्या तावडीतून पळाला,state
संजय दत्तची कारागृहातून सुटका नियमानुसारच -राम शिंदे,state
शौर्यपदकासाठी गडचिरोलीतील दहा जिगरबाज पोलिसांची नाव निश्चित,state
राहुरी साखर कारखान्याचे चेअरमन तनपुरेंची महिलांना शिवीगाळ,state
"भाजपची नावं पक्की, शिवसेनेचं सस्पेन्स कायम",state
"#बाप्पामोरयारे, घरोघरी आणि मंडळांमध्ये बाप्पांचं वाजतगाजत स्वागत",state
आशा भोसले-साधना सरगम यांची सुरेल जुगलबंदी,entertainment
धुळेकरांवर पाणी कपातीचं संकट,state
"मोदींची मिमिक्री भोवली, श्याम रंगिलाला 'लाफ्टर चॅलेंज'मधून वगळलं",entertainment
'हे' आहेत संजय जाधवचे 'लकी' स्टार्स,entertainment
"कुठे नेऊन ठेवलाय महाराष्ट्र माझा; पैशांना फुटले पाय, दारूचा महापूर !",state
"साईभक्त संतप्त, शंकराचार्यांविरोधात गुन्हा दाखल",state
"क्रिकेटमध्ये पुन्हा वादळ, अफगाणिस्तानच्या खेळाडूने ठोकले ६ चेंडूंत ६ षटकार",sports
"सचिनचा 'अर्जुन' चमकला, भेदक गोलंदाजीने दिल्ली सळो की पळो",sports
"भारताच्या विजयात केएल राहुल, कुलदीप यादवचा सिंहाचा वाटा, मालिकेत १-० ने आघाडी",sports
"Live Cricket Score, India vs Australia 2nd Test, 4th Day- ऑस्ट्रेलिया २४३ वर ऑल- आऊट, भारतासमोर २८६ धावांचं लक्ष्य",sports
"आयएएस-आयपीएस अधिकाऱ्यांच्या पोरांचा धिंगाणा, बारबालांसह 13 अटकेत",state
कुणीही आलं तरी टोल बंद होणार नाही -अजित पवार,state
लग्नाला नकार दिला म्हणून अल्पवयीन मुलीला जिवंत जाळलं; आरोपी ताब्यात,state
"ऊस पेरायचा असतो की लावायचा असतो ?,अजितदादांनी केली मुख्यमंत्र्यांची मिमिक्री",state
जीएसटी लागू झाल्याने मुंबईतले जकात नाके बंद,state
'शमिताभ' साकारताना...,entertainment
"मालवणच्या वायरी समुद्रात 8 विद्यार्थी बुडाले, 2 अत्यवस्थ",state
नितीन आगे हत्येप्रकरणी उज्जल निकम यांची नियुक्ती करा -आठवले,state
"मराठा आंदोलकांनी सोलापुरात दोन बसेस जाळल्या, पंढरपुरातही बस फाेडली",state
नंदुरबारमध्ये अशी आहे रुग्णांची व्यवस्था !,state
आज घटस्थापना; देवीच्या दर्शनास भाविकांची गर्दी,state
आज दिवसभर विधिमंडळात फक्त मराठा आरक्षणावर चर्चा,state
पंढरपुरात जमला वैष्णवांचा मेळा,state
60 तासांच्या मॅरेथाॅन नाट्य संमेलनाची आज सांगता,entertainment
ट्विटरने पुन्हा सस्पेंड केलं अभिजीतचं नवं अकाउंट,entertainment
शेतकर्‍याला मारहाण करणारे पोलीस निलंबित,state
'त्या' दोन संशयितांचा दाभोलकर खून प्रकरणाशी संबंध नाही !,state
दीपिकानं मेहंदी आर्टिस्टसमोर ठेवल्या इतक्या अटी,entertainment
...तर 24 व्या आठवड्यात गर्भपात करण्यास कोर्टाची परवानगी,state
रत्नागिरीत विद्युतसेवकांची भरती राणे समर्थकांनी उधळली,state
"पानसरे हत्येप्रकरणी आशा ठक्कर, सनातन महिला साधकाची चौकशी",state
Bigg Boss Marathi- आस्ताद काळे टॉप ५ मधून बाहेर...,entertainment
'दिल दोस्ती दुनियादारी'चा फ्रेंडशिप डे,entertainment
"अखेर टोल धाड बंद, सेना-भाजप कार्यकर्त्यांचा जल्लोष",state
अर्जुन खोतकर यांची आमदारकी रद्द! औरंगाबाद खंडपीठाचे आदेश,state
गोसेखुर्द सिंचन घोटाळ्याप्रकरणी 2 अधिकार्‍यांसह 5 कंत्राटदारांवर गुन्हे दाखल,state
टायगर श्राॅफचा जुळा भाऊ पाहिलात का?,entertainment
नील आणि भैरवीमध्ये येतंय नवं वादळ,entertainment
मंत्रालयाच्या पाचव्या मजल्यावरून उडी मारणाऱ्या हर्षल रावतेचा मृत्यू,state
"'बाबा'तर निष्क्रिय, 'दादां'ची हकालपट्टी करा'",state
"संजय दत्तनं भिकही मागितलीय, 'संजू'च्या टीझरमधून उलगडली अनेक गुपितं",entertainment
दाभोलकरांच्या खुनाच्या निषेर्धात अंनिसचं आंदोलन,state
"उमेश यादवने घडवला इतिहास, 19 वर्षानंतर केली 'ही' कामगिरी",sports
सलमानला वाचवण्याचा पोलिसांचा प्रयत्न,entertainment
"विहीर, बिबट्या आणि पिंजरा...पाहा रेस्क्यू ऑपरेशनचा थरार",state
"शिवसेना महाराष्ट्रात घडवणार राजकीय भूकंप, भाजपची धडधड वाढणार?",state
चक्क रुग्णवाहिकेत लागलं लग्न!,state
अडीच तासातच भाजप खासदारांनी सोडला उपवास; सॅण्डविचवर मारला ताव,state
"खडसेंना पंतप्रधानही व्हावंसं वाटेल,गिरीश महाजनांचा टोला",state
"डीएसकेंच्या अडचणीत वाढ, जावयाने ठोकला 100 कोटींचा अब्रुनुकसानीचा दावा",state
"पोलिसांची दंडेलशाही, बळीराजालाच झोडपलं",state
"भारतीय महिला क्रिकेटपटूची वादळी खेळी, 93 चेंडूत 206 धावा",sports
कार्यकर्त्यांनी वाढवली भुजबळांची डोकेदुखी,state
"उद्यापासून राज्यात प्लास्टिक बंदी, कापडी पिशवी बाळगायला विसरू नका!",state
पानिपतच्या लढाईचं गुढ उकलणार; पुण्यात आढळली चार ऐतिहासिक पत्रे!,state
कॅन्सरवर मात करत इरफान खान करणार 'या' बायोपिकमध्ये काम,entertainment
Happy Birthday- तबला नवाज झाकीर हुसैन यांच्या या गोष्टी तुम्हाला माहीतच नसतील,entertainment
VIDEO : स्वप्नील जोशी करतोय सचिनचं स्वागत,entertainment
"कुणी ढकलण्याची वाट पाहू नका, चव्हाणांची खडसेंना काँग्रेस प्रवेशाची आॅफर",state
"विधानसभा, विधानपरिषदेतही मराठा आरक्षणाचं विधेयक एकमताने मंजूर",state
'पाकिजा'फेम अभिनेत्री गीता कपूर यांचा करुण अंत,entertainment
महेंद्र सिंग धोनीसाठी खास ठरतंय २०१८ वर्ष,sports
डेक्कन क्वीनची डायनिंग कार खासगीकरणाच्या वाटेवर; रेल्वे कर्मचारी आणि प्रवासी नाराज,state
महाराष्ट्र सदन घोटाळा : चमणकरांचं मुख्यमंत्र्यांकडे एफआयआरची चौकशी करण्याची मागणी,state
"अरूण गवळी जेलबाहेरच, पॅरोलमध्ये 29 मेपर्यंत वाढ",state
आजच्या महाएपिसोडमध्ये राणादा जिंकणार कुस्ती पण...,entertainment
वर्ल्डकपसाठी अशी आहे टीम इंडिया,sports
बोभाटा झाला रे...,entertainment
मी माझ्या नवऱ्याची फॅन - निवेदिता सराफ,entertainment
एमसीए देणार सचिनला खास पेंटिंग भेट,sports
राहुल गांधींच्या विरोधात FTII समोर भाजप कार्यकर्त्यांची निदर्शनं,state
गडचिरोलीतला जहाल माओवादी आयतू पोलिसांना शरण,state
अॅडमिशन झाले पण शाळाच गायब !,state
आयपीएल सट्टेबाजीत अरबाजच्या नंतर साजिद खानही अडकला ?,entertainment
गुजरातमध्ये सेनेच्या सर्वच उमेदवारांचं डिपॉझिट जप्त,state
उल्हासनगरच्या उपायुक्ता विजया कंठेनी लाच मागतानाचा व्हिडिओ व्हायरल,state
जेव्हा विराट अनुष्काला डिनर डेटला घेऊन जातो,sports
ग्लॅमरस बाप्पा,entertainment
"मुलीच्या लग्नाच्या काळजी, दुष्काळग्रस्त शेतकऱ्याने केली आत्महत्या",state
'युवराजमध्ये कॅप्टनपदाचे गुण नव्हते म्हणून उचलबांगडी केली',sports
धुळे शहरातील त्रिविक्रम मंगल कार्यालयाला भीषण आग,state
काम मिळावं म्हणून बिग बींनी दीपिका-कतरिनाला पाठवला बायोडाटा!,entertainment
दारूड्या मुलाकडून जन्मदात्या आईला जिवंत जाळण्याचा प्रयत्न,state
काँग्रेसच्या काळात हेडगेवारांनी गोवंश हत्याबंदीचा ठराव मांडला होता-भागवत,state
#FitnessFunda : रणवीर सिंग वर्कआऊटसोबत 'हे'ही न चुकता करतो,entertainment
प्रवीण दरेकर शिवसेनेच्या वाटेवर? उद्धव ठाकरेंची घेतली भेट,state
खड्‌ड्यांविरोधात सांगलीकरांचा महामोर्चा,state
पृथ्वी शॉच्या या 10 गोष्टी तुम्हाला माहित आहेत का?,sports
"वाघाच्या पिंजाऱ्यात तरुणाची उडी, वाघालाच 'आशीर्वाद' देऊन आला बाहेर",state
खासदार राजू शेट्टींविरोधात खुनाचा गुन्हा दाखल,state
बॉक्स ऑफीसवर ‘सैराट’ सुस्साट; 3 दिवसात 12.10 कोटींची कमाई,entertainment
वाढदिवसाला दहशतवादावर नको बोलायला- आमीर खान,entertainment
'बेळगाव' आता 'बेळगावी' होणार,state
मिलिंद इंगळे यांच्याशी खास बातचीत,entertainment
औरंगाबाद जिल्ह्यात सापडले गुप्तधन;चांदीची नाणी आणि बरंच काही सापडल्याची चर्चा,state
काँग्रेसविरोधी मीडियातील प्रवृत्तींना ठेचून काढू -शिंदे,state
अखेरच्या सिनेमात श्रीदेवींच्या जागी झळकणार 'ही' अभिनेत्री,entertainment
"बैलगाडी शर्यतीत आला पहिला, अतिउत्साहात गाडीतून गेला तोल, आणि...! VIDEO",state
मेलबर्न टेस्ट ड्रा करण्यात टीम इंडियाला यश,sports
माणिकरावांचा मुख्यमंत्र्यांवर निशाणा?,state
कोण आहे मराठी बिग बाॅसमध्ये 16वा स्पर्धक?,entertainment
पीकविमा मुदतवाढीच्या बोगस जी.आर.पासून सावध राहा-महाराष्ट्र सरकार,state
मराठा मोर्च्यात वरात निघाली जोरात,state
"खाते गोठवण्याच्या निर्णयामुळे बीसीसीआयला हादरा, न्यूझीलंड सीरिज रद्द करण्याची दिली धमकी",sports
ठाण्यात मुख्यमंत्र्यांच्या होर्डिंगला काळं फासलं,state
"श्रीदेवी मृत्यू प्रकरणामागे दाऊदचा हात, स्वामींचं खळबळजनक वक्तव्य",entertainment
"म्हशीच्या धक्क्याने पत्नी विहिरीत पडली, वाचवण्यासाठी गेलेल्या पतीचाही मृत्यू",state
अहमदनगरच्या इमामपूर घाटात 'बर्निंग बस',state
VIDEO : ही पहा दहिहंडीची सुपर हिट गाणी,entertainment
"जानकरांच्या राजीनाम्यासाठी विरोधक आक्रमक, मुख्यमंत्र्यांनी केली पाठराखण",state
"नात्याला काळीमा, सख्या भावाकडूनच चिमुरडीवर लैंगिक अत्याचार",state
"असाही चोर, आधी देवाला नमन मग चोरीला प्रारंभ !",state
Success Story : नालेसफाई करत थेट गाठली केबीसीची हॉट सीट आणि जिंकले...!,entertainment
...हे गाव विकणे आहे !,state
रत्नागिरीत राष्ट्रवादी आणि नारायण राणेंमधला तिढा कायम,state
"नागपूरचं कौटुंबिक न्यायालय म्हणतंय, सोनू तुला माझ्यावर भरोसा नाय काय?",state
लोकसभेसाठी भाजपचं बीडचं तिकीट कुणाला? रावसाहेब दानवेंनी केली घोषणा!,state
विदर्भातील 4700 गावं दुष्काळग्रस्त घोषित करणे अशक्य -मुख्यमंत्री,state
विखेंच्या मुलाचा हट्ट मी  कसा पुरवणार - शरद पवार,state
शिवसेनेत नालायकांचा गोतावळा म्हणून बाहेर पडलो -राज ठाकरे,state
2 दिवसांत 5 चिमुरड्यांच्या मृत्यूची धक्कादायक कहाणी,state
केडगावतल्या 2 शिवसैनिक हत्या प्रकरणात काँग्रेस नगरसेवक विशाल कोतकरला अटक,state
"स्फोट करून असा उद्धवस्त करण्यात आला नीरव मोदीचा 100 कोटींचा बंगला, पाहा VIDEO",state
'एलबीटी'विरोधात पुण्यातल्या व्यापार्‍यांचा आज बंद,state
रोज 1700 टन घनकचरा करणाऱ्या पुण्यात फक्त 500 टन कचऱ्याचीच विल्हेवाट !,state
"'सोयी नाही तर मतदान नाही', गावकर्‍यांचा बहिष्कार",state
