headline,label
VIDEO: आशियाई क्रीडा स्पर्धेच्या अंतिम फेरीत धडक मारलेल्या मराठमोळ्या वीरधवल खाडेच्या मनात आहे तरी काय?,sports
करिनाच्या 'वीर दी वेडिंग'ची रिलीज तारीख ठरली,entertainment
"नागपुरात 'स्क्रब टायफस'चं थैमान, 12 जणांचा मृत्यू",state
पुन्हा 'हसवाफसवी',entertainment
कोस्टा रिकाचा 4-3ने पराभव करत नेदरलँडचा विजय,sports
प्रियांकाचा 'बेवॉच' फक्त प्रौढांसाठी,entertainment
संपूर्ण निकाल पाहा IBN लोकमतच्या वेबसाईटवर,state
गुहागरच्या समुद्रात 7 पर्यटक बुडाले,state
बिग बींनी ट्विट केला केबीसीचा पहिला प्रोमो,entertainment
निरगुडे गावात हनुमान जन्मोत्सव साजरा,state
अशा खेळाडूंवर आजन्म बंदी घालावी -शरद पवार,sports
"गणेश विसर्जनाला दुर्घटनांचे गालबोट, राज्यभरात 15 जणांचा मृत्यू",state
"'जैतापूर'ला देशहितासाठीच, कुणीही विरोध करू नये - मुख्यमंत्री",state
दानवेंना 'लक्ष्मीदर्शन' वक्तव्य भोवलं,state
'बिग बाॅस 12'मध्ये झळकणार एक मराठी अभिनेत्री,entertainment
"गडचिरोलीत कमळ उमललं, नगरपरिषदेवर भाजपचा झेंडा",state
रवी शास्त्री कोच झाले तर वर्षाला 7 कोटी कमावतील ?,sports
"'बाळासाहेब म्हटलेच होते, कमळाबाईची नजर दुसर्‍या पक्षावर'",state
गुजरात लायन्सचा विराटच्या टीमवर 'राॅयल' विजय,sports
अमित शहा-भागतवतांची मॅरेथॉन बैठक सुरू,state
'KitKat' च्या पाकिटामध्ये असं काही सापडलं की पोलीसही झाले थक्क,state
विनोद खन्नांना बाॅलिवूडकरांनी ट्विटरवरून वाहिली आदरांजली...,entertainment
मी धनगर आरक्षणामुळे मंत्री झालो नाही -महादेव जानकर,state
"...नाहीतर 5 जूनला महाराष्ट्र बंद, शेतकरी कोअर कमिटीचा इशारा",state
मुंबईचा पंजाबवर 3 धावांनी रोमहर्षक विजय,sports
IPL 2019 : यंदाच्या आयपीएलमध्ये मोडले जातील ‘हे’ चार विक्रम,sports
इटलीत उडाला विराट-अनुष्काच्या लग्नाचा बार!,entertainment
'हे' आहेत 65व्या राष्ट्रीय पुरस्कारांचे मानकरी,entertainment
उद्या देशभरातील औषध दुकानं बंद राहणार,state
पावसाअभावी राज्यात दुबार पेरणीचं संकट,state
3वर्षात महाराष्ट्र 10 वर्ष मागे गेला-नारायण राणेंचा सरकारवर हल्लाबोल,state
नव्या पालघर जिल्ह्याविरोधात याचिका दाखल,state
आता सुरू होणार महिलांचं आयपीएल!,sports
'या' गावात स्वातंत्र्यानंतर पहिल्यांदाच झालं मतदान,state
शहीद सुनील सुर्यवंशी यांचं पार्थिव खराब हवामानामुळे आणण्यात अडचणी,state
सिडनी टेस्टमध्ये ऑस्ट्रेलियाची दमदार सुरुवात,sports
"आता आमची सटकली, मला राग येतोय - अजित पवार",state
"PHOTOS : मलायका-अर्जुन कपूर एकाच कारमध्ये, कॅमेऱ्यात झाले कैद",entertainment
तुकाराम मुंढेंची पुणे परिवहन मंडळाच्या अध्यक्षपदी नियुक्ती,state
राज्यातील धरणांमध्ये फक्त 9 टक्के पाणीसाठा शिल्लक !,state
नक्षलवाद्यांच्या गोळीबारात महाराष्ट्राचे दोन पोलीस शहीद,state
...तर मग व्यावसायिकांच्या अन्नपदार्थांना बंदी का नाही? हायकोर्टाने मल्टिप्लेक्सना फटकारले,state
एकता कपूरच्या मालिकांपेक्षाही जास्त ट्विस्ट आहेत या मराठी मालिकेत,entertainment
सनीला 'लागली कुणाची उचकी',entertainment
"कोकणातले मच्छिमार संकटात, काय आहेत कारणं?",state
महाराष्ट्र बँक फसवणूक प्रकरणी सीबीआयचं मराठवाड्यात धाडसत्र,state
"जस्टिन बिबर मुंबईत दाखल, चाहत्यांची उत्सुकता शिगेला",entertainment
PHOTOS  सनी लिओनीनं मुलीचा तिसरा वाढदिवस असा केला साजरा,entertainment
दीपिकानं मिटवली रणवीरच्या प्रेमाची 'ही' अखेरची निशाणी,entertainment
"हत्या की आत्महत्या, शेत तळ्यात सापडला बहीण-भावाचा मृतदेह",state
'लंचबॉक्स'ला मागे टाकत 'द गुड रोड' ऑस्करच्या शर्यतीत,entertainment
"8-10 थर लागणार, बालगोविंदांवर बंदी कायम",state
"धोकादायक पूल पाडण्यासाठी दुसऱ्यांदा करावा लागला स्फोट, VIDEO आला समोर",state
..अन्यथा औरंगाबाद महापालिका बरखास्त करु – मुख्यमंत्री,state
'या' आजाराला तोंड देतेय सारा अली खान,entertainment
कोरेगाव भीमा प्रकरण : कोण काय म्हणालं?,state
अखेर जात पंचायतीविरोधात गुन्हा दाखल,state
शेतकर्‍यांना थेट ग्राहकांना विकता येईल शेतमाल !,state
'फॅट' आमिर असा बनला 'फिट',state
"जप्त केलेली तूरडाळ नगरसेवकांनी स्वस्तात विकली, काँग्रेसचा आरोप",state
फिल्मी फ्रायडे,entertainment
क्रिकेटच्या देवाचे ग्रंथालय; इतक्या भाषेत आहेत पुस्तके!,sports
"Bigg Boss Marathi: मेघा धाडेच्या पतीने व्यक्त केले, 'बिग बॉस मराठी'बद्दलचे आपले मत",entertainment
अभिनेत्री कंगनाने 'असं' पूर्ण केलं आपल्या आईचं स्वप्न,entertainment
"Video : पाकिस्तानच्या खेळाडूने रचला इतिहास, तोडला ८२ वर्ष जुना रेकॉर्ड",sports
"पुण्यात राष्ट्रवादीला धक्का, भाजपची मुसंडी",state
"कर्जमाफीवरुन भाजपच्या मंत्र्यांमध्येच गोंधळ,चंद्रकांत पाटलांनी फोडलं बँकावरच खापर !",state
बाबासाहेबांनी वापरलेल्या 400 पेक्षा जास्त वस्तू नष्ट होण्याच्या मार्गावर,state
आंदोलकच सत्तेत!आता आंदोलनाचे प्रश्न सुटतील का?,state
'जीक्यू' अॅवाॅर्ड सोहळ्यात सजली सिताऱ्यांची मैफल,entertainment
नर्सरीत तीन वर्षाखालील मुलांना मिळालेले प्रवेश होणार रद्द,state
दुसऱ्या टप्प्यातील 14 नगरपालिकांसाठी मतदान सुरू,state
अखेर स्पेनने लाज राखली,sports
औरंगाबाद अग्नितांडव प्रकरणी फटाका असोसिएशनवर गुन्हा दाखल,state
"येत्या २४ तासांत विदर्भ, मराठवाडा आणि कोकणात वादळी वाऱ्यासह पाऊस!",state
"बाॅक्स आॅफिसचा बादशहा 'रईस','काबील'ला टाकलं मागे",entertainment
IPL 2019 : आरसीबी आतापर्यंत विजेता का नाही? विराटने सांगितलं खरं कारण,sports
बांऊसर लागल्यामुळे पाकिस्तानच्या तरूण क्रिकेटरचा मृत्यू,sports
"प्रियांकाच्या ड्रेसमध्ये दडलंय निकचं नाव, पाहा व्हिडिओ",entertainment
"कोल्हापुरातील सलूनवाला असा करतोय अभिनंदनच्या शौर्याला सलाम, पाहा VIDEO",state
"नाशिकमध्ये गुंडाराज, आरोपींनी पोलिसांनाच केली मारहाण",state
महाराष्ट्रात बैलगाडा शर्यतींचा मार्ग मोकळा,state
दहावीचा निकाल उद्या होणार जाहीर,state
शशांक मनोहर यांचा आयसीसीच्या अध्यक्षपदाचा राजीनामा,sports
"मितालीचा नवा चाहता, पहा खट्याळ ज्य़ुनिअर धवन काय काय करतो!",sports
झी मराठीनं मागितली आगरी समाजाची माफी,entertainment
"कर्जमाफी प्रकियेतील आधार कार्ड घोळाची थेट 'पीएमओ'कडून दखल, राज्याकडे मागितला अहवाल",state
शिवसेनेचा भाजपसमोर नवा प्रस्ताव,state
"शरद पवारांचा वारसदार कोण ?, अजित पवार म्हणतात...",state
आता बिग बाॅसच्या घरात पाहायला मिळणार 'या' अभिनेत्रींचा जलवा,entertainment
साक्षी तन्वरशी दिलखुलास गप्पा,entertainment
वाशिंद रेल्वे स्थानकात संतप्त प्रवाशांचा 'रेलरोको',state
अखेर दीपिका-रणवीरच्या लग्नाची तारीख झाली फिक्स,entertainment
शरद पवारांसारखा सहकार चळवळीला मदत करणारा नेता हवा -आनंद अडसूळ,state
"बाळासाहेबांची भूमिका कोण साकारणार ?, अजय देवगण की नवाजुद्दिन ?",state
अनुष्कानं सोशल मीडियावर शेअर केला हनिमूनचा फोटो,entertainment
गर्भलिंग निदानाचा फिरता धंदा ; कोण आहे सूत्रधार ?,state
...आणि संभाजी महाराज रायगडावर पोचले,entertainment
"महायुतीच्या सभेआधी, माढाचा तिढा सुटणार का?",state
महाराष्ट्र बँक बंद करण्याचा सरकारचा डाव - राज ठाकरे,state
पंतप्रधानांची 56 इंचाची छाती असताना दहशतवादी हल्ले होतातच कसे? - शरद पवार,state
Birthday Special : 'असं' करणार शनाया वाढदिवसाचं सेलिब्रेशन!,entertainment
'भीमा कोरेगावमध्ये सभेची  परवानगी देणार नाही',state
रवी किशननं साइन केले सात भोजपुरी सिनेमे,entertainment
दाभोलकर खून प्रकरणी 'सनातन'चा साधक ताब्यात,state
नवाजुद्दीन सिद्दीकी येतोय भारतीय क्रिकेट कोच बनून!,entertainment
राष्ट्रपतीपदाबद्दल चर्चा 'मातोश्री'वरच होईल - संजय राऊत,state
प्रियंकाच्या बॅचलर पार्टीत 'हिचीच' हवा,entertainment
PHOTOS : न्यूज18च्या आयरिल अवाॅर्ड्समध्ये 'सेक्रेड गेम्स'ची धूम,entertainment
"'ये अंदर की बात है..,राज ठाकरे हमारे साथ है'",state
"‘या’ क्रिकेटपटूचे विक्रम सचिन, द्रविडला मोडता आले नाही!",sports
नाना पटोलेंची काँग्रेसमध्ये घरवापसी होणार,state
"Photos : आलियाला आवरला नाही पिझ्झाचा मोह, काठीच्या आधारे पार्टीला हजर",entertainment
अतिवृष्टीग्रस्तांवर जंगलात राहण्याची नामुष्की !,state
राज्यपालांच्या दौर्‍यासाठी आदिवासी गाव चकाचक,state
कोल्हापूरमध्ये संविधान दिनानिमित्त रॅली,state
गणपतीची वर्गणी न दिल्यामुळे दुकानदारांना काढायला लावल्या उठाबशा,state
पुण्यात रंगला काश्मीर महोत्सव,entertainment
"Valentine Day च्या दिवशीच जन्मलेल्या मधुबाला, अधुरी राहिली त्या गुलाब आणि चिठ्ठीची कहाणी",entertainment
"मारेकरी सापडले, सूत्रधाराचा शोध कधी लागणार?",state
BIGG BOSS12 मधून बाहेर पडल्यावर नेहा पेंडसेची पहिली मुलाखत,entertainment
केबीसीएल घोटाळ्याच्या 'भाऊ'साहेबला बेड्या ठोका !,state
सचिन पिळगावकर यांच्याशी गप्पा,entertainment
"सेनेचा 'समझोता', शरीफ यांच्या साक्षीने घेणार शपथ !",state
नेहाची नवी इनिंग,entertainment
नागपूर मेडिकल कॉलेजमधल्या डॉक्टरांच्या संपाचा तिसरा दिवस,state
"मलायका- अर्जुनचं सोडा, या सेलिब्रिटी जोडींच्या वयातही आहे 10 वर्षांहून जास्त अंतर",entertainment
पोलिसांच्या समोर 'ती'चं अपहरण करून पुन्हा केला बलात्कार,state
"चोरीचा माल 'ओएलक्स पे बेच दे', स्कॉलर दरोडेखोर गजाआड",state
तब्बल 40 क्विंटल धान्य जमिनीत पुरलं !,state
'कमली'च्या निमित्ताने,entertainment
... अन्यथा उद्यापासून बँका बंद ; पुणे सहकारी बँक असोसिएशनचा इशारा,state
"वादग्रस्त राधे माँ औरंगाबादेत, पोलिसांनी केली 2 तास चौकशी",state
विसर्जन मिरवणुकीतील क्षणचित्र,entertainment
"तुळजापुरात बोलेरो गाडीत सापडले 6 कोटी, सर्व 500-1000 च्या नोटा",state
अभिनेते रणजीत यांच्या फार्महाऊसजवळ सापडले होते 6 मृतदेह,state
"10 वर्षं निवडणूक बंदी का घालू नये ?, अजित पवारांसह सहकारसम्राटांना नोटीसा",state
"रणबीर-आलियाचं अजून एक फोटोशूट, सोडत नाहीत एकमेकांची साथ",entertainment
भारतासमोर विजयासाठी ३०४ रन्सचं आव्हान,sports
"आंबेनळी बस अपघातापूर्वी दोनवेळा ड्रायव्हर बदलले, दापोली विद्यापीठाचा अहवाल",state
सेलिब्रिटी'फुल्ल' 'फिल्मफेअर' !,entertainment
एकनाथ खडसे दोन दिवस मुक्ताईनगर मुक्कामी,state
मुख्यमंत्री-प्रदेशाध्यक्ष यांच्यातला वाद उफाळला,state
कानमध्ये स्टाइल आयकाॅन सोनमचा स्टाइलिश लूक,entertainment
दोन वेगवेगळ्या घटनामध्ये 100 क्विंटल कांदा जळून खाक,state
मावळ गोळीबार प्रकरणाची पुन्हा चौकशी करा- हायकोर्टाचे आदेश,state
गेल्या दीड वर्षापासून महिला पोलीस अधिकारी बेपत्ता,state
बिग बींची 'लोकल'वारी,entertainment
अजूनही सामाजिक बहिष्काराचे जोखड खांद्यावरच !,state
मेधा पाटकर आम आदमी पार्टीत?,state
दहीहंडीला सेलिब्रिटींचा तडका,entertainment
"'माझ्या मायचा खून केला पप्पानं, त्याचा पण खून करा'; आईच्या हत्येनंतर मुलीचा VIDEO",state
"19 मार्चला मनसेचं इंजिन घड्याळासोबत धावणार?, राज ठाकरेंच्या घोषणेकडे सर्वांच लक्ष",state
हिंदी 'पोस्टर बाॅइज'च्या स्क्रीनिंगला बाॅलिवूडची हजेरी,entertainment
काँग्रेस -राष्ट्रवादीला मतदान केलं म्हणून दोन गटांत तुंबळ हाणामारी,state
'दंगल'गर्ल पूजा बनसोडेची क्रीडा अधिकाऱ्यांकडून अडवणूक,state
शिवसेनेचे आ.संजय जाधवांना 3 महिन्यांची सक्तमजुरी,state
"आगीत होरपळून या 3 चिमुरड्यांचा झाला मृत्यू, जालन्यातली डोळ्यात अश्रू आणणारी घटना",state
आमच्यासाठी नारायण राणे भाजपमध्ये जाणार ही चर्चा निराधार- नितेश राणे,state
सिनेमा वाचवण्यासाठी सुप्रसिद्ध अभिनेत्री प्रिया प्रकाशची सुप्रीम कोर्टात धाव!,entertainment
लाच घेताना अभियंता कॅमेर्‍यात कैद,state
महिला दिन विशेष : ‘ती’च्या जगण्यातला संघर्ष...,state
राज्यातील सिंचन प्रकल्पांना 1 हजार कोटी देणार -गडकरी,state
"बिग बाॅस मराठी : सईने मागितली रेशमची माफी, रेशम माफ करणार का ?",entertainment
#बाप्पामोरयारे : या 'दंगलगर्ल्स'ना एकदा ऐकाच,entertainment
"प्रेमाचा करुण अंत, बॉयफ्रेंडने प्रेयसीला जिवंतच दिलं पेटवून",state
"भारत बंद! देशभरात कोट्यवधी कर्मचारी संपावर, मुंबईत आज एकही बस धावली नाही",state
मनसेचं अस्तित्व धोक्यात?,state
जगातील सगळ्यात कमी उंचीची मुलगी झाली 'या' पोस्टमुळे हैराण,state
अभिनेत्री प्रार्थना बेहरेचं शुभमंगल 14 नोव्हेंबरला,entertainment
गोदावरीच्या पाण्यावरून मराठवाडा-नगरमध्ये जुंपली,state
न्यू इयरमुळे मुंबई गोवा हायवेवर तीन दिवस अवजड वाहनांना बंदी,state
आमदार फुटण्याच्या भितीमुळेच शिवसेना लाचार - नारायण राणे,state
वर्ल्ड चॅम्पियनशिपमध्ये सायना क्वार्टर फायनलमध्ये,sports
सलग सुट्‌ट्यांमुळे मुंबई-पुणे एक्स्प्रेस-वेची वाहतूक संथ,state
"आमदार साहेब, 25 व्या वर्षी मिळवली आमदारकी !",state
'पद्मावत' फेसबुकवर झाला लाईव्ह; हजारो लोकांनी केला शेअर,entertainment
"गडकरींचा तोल ढळला, 'चव्हाण सरपंच बनण्याच्या लायकीचे नाही'",state
"हार्बर रेल्वे कोलमडली, रुळाला तडे गेल्यामुळे सीएसटीकडे जाणारी वाहतूक ठप्प",state
